{
  "version": 2,
  "rest": [
    {
      "node": 0,
      "translation": [
        0,
        1,
        0
      ],
      "rotation": [
        0,
        0,
        0,
        1
      ]
    }
  ],
  "tracks": [
    {
      "node": 0,
      "keys": [
        {
          "frame": 6,
          "translation": [
            0,
            1,
            0
          ],
          "rotation": [
            0,
            0,
            0,
            1
          ],
          "curves": [
            [
              20,
              5,
              100,
              120
            ],
            [
              50,
              100,
              90,
              10
            ],
            [
              10,
              110,
              110,
              30
            ],
            [
              35,
              0,
              90,
              127
            ]
          ]
        },
        {
          "frame": 30,
          "translation": [
            0.1,
            1,
            0
          ],
          "rotation": [
            0,
            0,
            0,
            1
          ],
          "curves": [
            [
              20,
              5,
              100,
              120
            ],
            [
              50,
              100,
              90,
              10
            ],
            [
              10,
              110,
              110,
              30
            ],
            [
              35,
              0,
              90,
              127
            ]
          ]
        }
      ]
    }
  ],
  "weights": [
    {
      "node": 0,
      "sampler": 2
    }
  ]
}
